count,description,price,title,img
4,Fully-featured for home and ongo gaming.,240,Nintendo Switch,https://images-na.ssl-images-amazon.com/images/I/61JnrafZ7zL._AC_SL1457_.jpg
6,The PlayStation 4 (PS4) is a home video game console developed by Sony Computer Entertainment,10,PlayStation 4 (PS4),https://image.coolblue.be/max/500x500/products/567947
7,The Xbox One is a home video game console developed by Microsoft. Announced in May 2013,23,Xbox One,https://upload.wikimedia.org/wikipedia/commons/thumb/0/05/Microsoft-Xbox-One-Console-Set-wKinect.jpg/1200px-Microsoft-Xbox-One-Console-Set-wKinect.jpg
12,Death Stranding is an action game developed by Kojima Productions.,15,Death Stranding,https://upload.wikimedia.org/wikipedia/en/thumb/2/22/Death_Stranding.jpg/220px-Death_Stranding.jpg
7,Cyberpunk 2077 is an upcoming action role-playing video game developed and published by CD Projekt Red,23,Cyberpunk 2077,https://upload.wikimedia.org/wikipedia/en/9/9f/Cyberpunk_2077_box_art.jpg
8,Call of Duty: Modern Warfare is a 2019 first-person shooter video game developed by Infinity Ward and published by Activision.,15,Call of Duty: Modern Warfare,https://upload.wikimedia.org/wikipedia/en/thumb/e/e9/CallofDutyModernWarfare%282019%29.jpg/220px-CallofDutyModernWarfare%282019%29.jpg
2,Ghost of Tsushima is an action-adventure game developed by Sucker Punch Productions and published by Sony Interactive Entertainment,23,Ghost of Tsushima,https://upload.wikimedia.org/wikipedia/en/thumb/b/b6/Ghost_of_Tsushima.jpg/220px-Ghost_of_Tsushima.jpg
3,Tom Clancy's Ghost Recon Breakpoint is an online tactical shooter video game developed by Ubisoft Paris and published by Ubisoft. The game was released worldwide on 4 October 2019 for Microsoft Windows PlayStation 4 and Xbox One and on 18 December 2019 for Stadia.,39,Tom Clancy's Ghost Recon Breakpoint,https://www.xyz.co.za/ProdImg/Big_3307216136569-01.jpg
